Sheet: Sheet2
A1: Date | B1: Hour | C1: Request Count
A2: 2025-04-25 | B2: 0 | C2: 0
A3: 2025-04-25 | B3: 1 | C3: 2
A4: 2025-04-25 | B4: 2 | C4: 2
A5: 2025-04-25 | B5: 3 | C5: 0
A6: 2025-04-25 | B6: 4 | C6: 2
A7: 2025-04-25 | B7: 5 | C7: 5
A8: 2025-04-25 | B8: 6 | C8: 4
A9: 2025-04-25 | B9: 7 | C9: 3
A10: 2025-04-25 | B10: 8 | C10: 13
A11: 2025-04-25 | B11: 9 | C11: 5
A12: 2025-04-25 | B12: 10 | C12: 8
A13: 2025-04-25 | B13: 11 | C13: 6
A14: 2025-04-25 | B14: 12 | C14: 6
A15: 2025-04-25 | B15: 13 | C15: 10
A16: 2025-04-25 | B16: 14 | C16: 8
A17: 2025-04-25 | B17: 15 | C17: 4
A18: 2025-04-25 | B18: 16 | C18: 25
A19: 2025-04-25 | B19: 17 | C19: 15
A20: 2025-04-25 | B20: 18 | C20: 9
A21: 2025-04-25 | B21: 19 | C21: 8
A22: 2025-04-25 | B22: 20 | C22: 4
A23: 2025-04-25 | B23: 21 | C23: 0
A24: 2025-04-25 | B24: 22 | C24: 1
A25: 2025-04-25 | B25: 23 | C25: 2

Sheet: Tabelle1
A1: Datum | B1: Besucher | C1: W | D1: G | E1: MV | F1: E | G1: F | H1: W | I1: F -2h | J1: M+G+W | K1: W+G | L1: F | M1: https://wiki.documentfoundation.org/Documentation/Calc_Functions/LINEST
A2: 2024-12-13 | B2: 27 | C2: 3 | D2: 59 | E2: 0 | F2: 0 | H2: 3 | J2: of:=[.$Q$9]+[.$P$9]*[.C2]+[.$O$9]*[.D2]+[.$N$9]*[.E2] -> 33.5457892075318 | K2: of:=[.$P$17]+[.$O$17]*[.C2]+[.$N$17]*[.D2] -> 40.4202972376474 | M2: Korrelationskoeffizient Wetter | N2: of:=CORREL([.B:.B];[.C:.C]) -> -0.468540895836958
A3: 2024-12-20 | B3: 12 | C3: 3 | D3: 49 | E3: 0 | F3: 0 | H3: 3 | J3: of:=[.$Q$9]+[.$P$9]*[.C3]+[.$O$9]*[.D3]+[.$N$9]*[.E3] -> 29.4489467200305 | K3: of:=[.$P$17]+[.$O$17]*[.C3]+[.$N$17]*[.D3] -> 36.1024433628873 | M3: Korrelationskoeffizient Google | N3: of:=CORREL([.B:.B];[.D:.D]) -> 0.494168417968
A4: 2024-12-27 | B4: 48 | C4: 3 | D4: 41 | E4: 0 | F4: 0 | H4: 3 | J4: of:=[.$Q$9]+[.$P$9]*[.C4]+[.$O$9]*[.D4]+[.$N$9]*[.E4] -> 26.1714727300295 | K4: of:=[.$P$17]+[.$O$17]*[.C4]+[.$N$17]*[.D4] -> 32.6481602630792 | M4: Korrelationskoeffizient Monatsvortrag | N4: of:=CORREL([.B:.B];[.E:.E]) -> 0.312481122474982
A5: 2025-01-10 | B5: 30 | C5: 1 | D5: 76 | E5: 0 | F5: 0 | H5: 1 | J5: of:=[.$Q$9]+[.$P$9]*[.C5]+[.$O$9]*[.D5]+[.$N$9]*[.E5] -> 82.7192502248278 | K5: of:=[.$P$17]+[.$O$17]*[.C5]+[.$N$17]*[.D5] -> 88.8504414608621 | M5: Korrelationskoeffizient Website | N5: of:=CORREL([.B:.B];[.G:.G]) -> 0.566958940472623 | S5: Glossar
A6: 2025-01-17 | B6: 70 | C6: 3 | D6: 112 | E6: 1 | F6: 0 | H6: 3 | J6: of:=[.$Q$9]+[.$P$9]*[.C6]+[.$O$9]*[.D6]+[.$N$9]*[.E6] -> 91.994952062153 | K6: of:=[.$P$17]+[.$O$17]*[.C6]+[.$N$17]*[.D6] -> 63.3049227738757 | M6: Korrelationskoeffizient Website Google | N6: of:=CORREL([.D:.D];[.G:.G]) -> 0.758028130486794 | S6: M | T6: Monatsvortrag
A7: 2025-01-24 | B7: 115 | C7: 2 | D7: 128 | E7: 0 | F7: 0 | H7: 2 | J7: of:=[.$Q$9]+[.$P$9]*[.C7]+[.$O$9]*[.D7]+[.$N$9]*[.E7] -> 82.9184167655627 | K7: of:=[.$P$17]+[.$O$17]*[.C7]+[.$N$17]*[.D7] -> 90.7583852915531 | M7: Korrelationskoeffizient F zu F-2H | N7: of:=CORREL([.G14:.G19];[.I14:.I19]) -> 0.899934270006496 | S7: F | T7: Website Page Führungen
A8: 2025-01-31 | B8: 110 | C8: 2 | D8: 128 | E8: 0 | F8: 0 | H8: 2 | J8: of:=[.$Q$9]+[.$P$9]*[.C8]+[.$O$9]*[.D8]+[.$N$9]*[.E8] -> 82.9184167655627 | K8: of:=[.$P$17]+[.$O$17]*[.C8]+[.$N$17]*[.D8] -> 90.7583852915531 | N8: Lineare Regression MV+G+W | S8: F -2h | T8: Website Page Führungen bis 2 Stunden vor Vortragsstart
A9: 2025-02-07 | B9: 75 | C9: 1 | D9: 125 | E9: 0 | F9: 0 | H9: 1 | J9: of:=[.$Q$9]+[.$P$9]*[.C9]+[.$O$9]*[.D9]+[.$N$9]*[.E9] -> 102.793778413584 | K9: of:=[.$P$17]+[.$O$17]*[.C9]+[.$N$17]*[.D9] -> 110.007925447186 | N9: of:=LINEST([.B2:.B21];[.C2:.E21];1;1) -> 36.7358976708642 | O9: 0.409684248750131 | P9: -21.1044143942719 | Q9: 72.6876617140897 | S9: E | T9: Event kurz vor oder nach Freitag
A10: 2025-02-14 | B10: 75 | C10: 3 | D10: 69 | E10: 0 | F10: 0 | H10: 3 | J10: of:=[.$Q$9]+[.$P$9]*[.C10]+[.$O$9]*[.D10]+[.$N$9]*[.E10] -> 37.6426316950331 | K10: of:=[.$P$17]+[.$O$17]*[.C10]+[.$N$17]*[.D10] -> 44.7381511124074 | N10: 21.1487979469295 | O10: 0.206978580897887 | P10: 8.44721940740193 | Q10: 28.0398593401379 | S10: W | T10: Wetter
A11: 2025-02-21 | B11: 160 | C11: 1 | D11: 134 | E11: 1 | F11: 0 | H11: 1 | J11: of:=[.$Q$9]+[.$P$9]*[.C11]+[.$O$9]*[.D11]+[.$N$9]*[.E11] -> 143.2168343232 | K11: of:=[.$P$17]+[.$O$17]*[.C11]+[.$N$17]*[.D11] -> 113.893993934471 | N11: 0.493968454513287 | O11: 32.7030543626015 | S11: G | T11: Google
A12: 2025-02-28 | B12: 105 | C12: 2 | D12: 100 | E12: 0 | F12: 0 | G12: 195 | H12: 2 | J12: of:=[.$Q$9]+[.$P$9]*[.C12]+[.$O$9]*[.D12]+[.$N$9]*[.E12] -> 71.447257800559 | K12: of:=[.$P$17]+[.$O$17]*[.C12]+[.$N$17]*[.D12] -> 78.668394442225 | L12: of:=[.$O$33]+[.$N$33]*[.G12] -> 91.7773908180386 | N12: 5.20619405562343 | O12: 16
A13: 2025-03-07 | B13: 150 | C13: 1 | D13: 134 | E13: 0 | F13: 0 | G13: 232 | H13: 1 | J13: of:=[.$Q$9]+[.$P$9]*[.C13]+[.$O$9]*[.D13]+[.$N$9]*[.E13] -> 106.480936652335 | K13: of:=[.$P$17]+[.$O$17]*[.C13]+[.$N$17]*[.D13] -> 113.893993934471 | L13: of:=[.$O$33]+[.$N$33]*[.G13] -> 113.076986628705 | N13: 16703.9137657077 | O13: 17111.8362342923
A14: 2025-03-14 | B14: 32 | C14: 3 | D14: 63 | E14: 0 | F14: 0 | G14: 104 | H14: 3 | I14: 86 | J14: of:=[.$Q$9]+[.$P$9]*[.C14]+[.$O$9]*[.D14]+[.$N$9]*[.E14] -> 35.1845262025324 | K14: of:=[.$P$17]+[.$O$17]*[.C14]+[.$N$17]*[.D14] -> 42.1474387875514 | L14: of:=[.$O$33]+[.$N$33]*[.G14] -> 39.3918984188317
A15: 2025-03-21 | B15: 120 | C15: 1 | D15: 93 | E15: 0 | F15: 0 | G15: 156 | H15: 1 | I15: 104 | J15: of:=[.$Q$9]+[.$P$9]*[.C15]+[.$O$9]*[.D15]+[.$N$9]*[.E15] -> 89.68388245358 | K15: of:=[.$P$17]+[.$O$17]*[.C15]+[.$N$17]*[.D15] -> 96.1907930479542 | L15: of:=[.$O$33]+[.$N$33]*[.G15] -> 69.3264655040928
A16: 2025-03-28 | B16: 25 | C16: 3 | D16: 182 | E16: 0 | F16: 1 | G16: 204 | H16: 3 | I16: 160 | J16: of:=[.$Q$9]+[.$P$9]*[.C16]+[.$O$9]*[.D16]+[.$N$9]*[.E16] -> 83.9369518037979 | K16: of:=[.$P$17]+[.$O$17]*[.C16]+[.$N$17]*[.D16] -> 93.5298998971962 | L16: of:=[.$O$33]+[.$N$33]*[.G16] -> 96.9583735827953 | N16: Lineare Regression Wetter, Google
A17: 2025-04-04 | B17: 80 | C17: 1 | D17: 75 | E17: 0 | F17: 0 | G17: 193 | H17: 1 | I17: 175 | J17: of:=[.$Q$9]+[.$P$9]*[.C17]+[.$O$9]*[.D17]+[.$N$9]*[.E17] -> 82.3095659760777 | K17: of:=[.$P$17]+[.$O$17]*[.C17]+[.$N$17]*[.D17] -> 88.4186560733861 | L17: of:=[.$O$33]+[.$N$33]*[.G17] -> 90.6260613147593 | N17: of:=LINEST([.B2:.B20];[.C2:.D20];1;1) -> 0.431785387476007 | O17: -20.5448963180613 | P17: 76.579648330747
A18: 2025-04-11 | B18: 51 | C18: 2 | D18: 63 | E18: 0 | F18: 0 | G18: 143 | H18: 2 | I18: 124 | J18: of:=[.$Q$9]+[.$P$9]*[.C18]+[.$O$9]*[.D18]+[.$N$9]*[.E18] -> 56.2889405968042 | K18: of:=[.$P$17]+[.$O$17]*[.C18]+[.$N$17]*[.D18] -> 62.6923351056127 | L18: of:=[.$O$33]+[.$N$33]*[.G18] -> 61.8428237327775 | N18: 0.225868227556492 | O18: 9.31839703926255 | P18: 32.563516567168
A19: 2025-04-25 | B19: 80 | C19: 3 | D19: 70 | E19: 1 | F19: 0 | G19: 142 | H19: 3 | I19: 127 | J19: of:=[.$Q$9]+[.$P$9]*[.C19]+[.$O$9]*[.D19]+[.$N$9]*[.E19] -> 74.7882136146475 | K19: of:=[.$P$17]+[.$O$17]*[.C19]+[.$N$17]*[.D19] -> 45.1699364998834 | L19: of:=[.$O$33]+[.$N$33]*[.G19] -> 61.2671589811378 | N19: 0.410768890026467 | O19: 34.9910806960785
A20: 2025-05-02 | B20: 50 | C20: 1 | D20: 62 | E20: 0 | F20: 0 | G20: 131 | H20: 1 | I20: 123 | J20: of:=[.$Q$9]+[.$P$9]*[.C20]+[.$O$9]*[.D20]+[.$N$9]*[.E20] -> 76.983670742326 | K20: of:=[.$P$17]+[.$O$17]*[.C20]+[.$N$17]*[.D20] -> 82.8054460361981 | L20: of:=[.$O$33]+[.$N$33]*[.G20] -> 54.9348467131019 | N20: 5.57701564732272 | O20: 16
A21: 2025-05-09 | B21: 50 | C21: 1 | D21: 56 | E21: 0 | F21: 0 | G21: 138 | H21: 1 | I21: 125 | J21: of:=[.$Q$9]+[.$P$9]*[.C21]+[.$O$9]*[.D21]+[.$N$9]*[.E21] -> 74.5255652498252 | K21: of:=[.$P$17]+[.$O$17]*[.C21]+[.$N$17]*[.D21] -> 80.214733711342 | L21: of:=[.$O$33]+[.$N$33]*[.G21] -> 58.9644999745793 | N21: 13656.7251896336 | O21: 19590.0116524717
A22: 2025-05-16 | B22: 90 | C22: 2 | E22: 1 | F22: 0 | H22: 2 | J22: of:=[.$Q$9]+[.$P$9]*[.C22]+[.$O$9]*[.D22]+[.$N$9]*[.E22] -> 67.2147305964102 | K22: of:=[.$P$17]+[.$O$17]*[.C22]+[.$N$17]*[.D22] -> 35.4898556946243 | L22: of:=[.$O$33]+[.$N$33]*[.G22] -> -20.4772357516905
N24: Lineare Regression Google
N25: of:=LINEST([.B2:.B15];[.D2:.D15];1;1) -> 1.15613583827582 | O25: -27.6210059985426
N26: 0.228469366757244 | O26: 22.6475430242465
N27: 0.680912004758368 | O27: 27.7956382635606
N28: 25.6071810251367 | O28: 12
N29: 19784.0442079697 | O29: 9271.17007774459
N32: Lineare Regression Website
N33: of:=LINEST([.B12:.B18];[.G12:.G18];1;1) -> 0.575664751639636 | O33: -20.4772357516905
N34: 0.412646342217782 | O34: 74.1968810498811
N35: 0.28018002349672 | O35: 43.74718529182
N36: 1.94618121643254 | O36: 5
N37: 3724.63318093011 | O37: 9569.08110478418
N40: Lineare Regressions Website, Wetter
N41: of:=LINEST([.B12:.B18];[.G12:.H18];1;1) -> -39.0058229518179 | O41: 0.236552660289752 | P41: 111.403654885444
N42: 14.7161793623702 | O42: 0.305923891530955 | P42: 70.514393263175
N43: 0.738849414218194 | O43: 29.4604025470217
N44: 5.65841667179341 | O44: 4
N45: 9822.05301278403 | O45: 3471.66127293025